### ISSUE TITLE
unable to run dropwatch in network namespace

### ISSUE THREAD

**Issue by gwuah** [nhorman/dropwatch#73]
Hi, thanks for working on the tool!
When I run it in my "default" namespace, it works fine.
The moment I run it in a custom namespace i created, i get the error "Unable to find NET_DM family, dropwatch can't work"
I'm running DO Ubuntu 22.04 x64

Luckily I was running tcpdum & I saw this. Don't know if it's helpful but just though i should add it.
```
18:40:35.373668 lo    In  IP 127.0.0.53 > 127.0.0.1: ICMP 127.0.0.53 udp port 53 unreachable, length 75
18:40:35.375820 lo    In  IP 127.0.0.53 > 127.0.0.1: ICMP 127.0.0.53 udp port 53 unreachable, length 75
18:40:35.375920 lo    In  IP 127.0.0.53 > 127.0.0.1: ICMP 127.0.0.53 udp port 53 unreachable, length 75
18:40:35.376005 lo    In  IP 127.0.0.53 > 127.0.0.1: ICMP 127.0.0.53 udp port 53 unreachable, length 75
18:40:35.376111 lo    In  IP 127.0.0.53 > 127.0.0.1: ICMP 127.0.0.53 udp port 53 unreachable, length 75
18:40:35.376189 lo    In  IP 127.0.0.53 > 127.0.0.1: ICMP 127.0.0.53 udp port 53 unreachable, length 75
18:40:35.376279 lo    In  IP 127.0.0.53 > 127.0.0.1: ICMP 127.0.0.53 udp port 53 unreachable, length 75
18:40:35.376359 lo    In  IP 127.0.0.53 > 127.0.0.1: ICMP 127.0.0.53 udp port 53 unreachable, length 75
```

**Comment by nhorman** [comment]
That looks like a simply fix, the genl_family struct in the kernels drop monitor code doesn't have netnsok set to true.  If you have time to build a kernel with that change and test that it solves your problem, it should be as easy as:
diff --git a/net/core/drop_monitor.c b/net/core/drop_monitor.c
index 41cac0e4834e..646e2764cb89 100644
--- a/net/core/drop_monitor.c
+++ b/net/core/drop_monitor.c
@@ -1656,6 +1656,7 @@ static struct genl_family net_drop_monitor_family __ro_after_init = {
        .post_doit      = net_dm_nl_post_doit,
        .module         = THIS_MODULE,
        .small_ops      = dropmon_ops,
+       .netnsok        = true,
        .n_small_ops    = ARRAY_SIZE(dropmon_ops),
        .mcgrps         = dropmon_mcgrps,
        .n_mcgrps       = ARRAY_SIZE(dropmon_mcgrps),

Note however, this won't give you any magic filtering on namespaces.  dropmonitor watches for drops in the kernel irrespective of namespacing, so this just gives you the convenience of being able to run dropwatch in whatever namespace you're executing

**Comment by gwuah** [comment]
> dropmonitor watches for drops in the kernel irrespective of namespacing

I see. There's no need to run it in a namespace then. Thanks
